{
  "schema": "blue-rooted-processing-fixture/1.0-draft.1",
  "id": "RCP-SEL-001",
  "category": "SEL",
  "title": "No pending bindings",
  "kind": "selector",
  "requirements": [
    "RCP-ORDER-01",
    "RCP-PROGRESS-01"
  ],
  "input": {
    "bindings": []
  },
  "expected": {
    "trace": []
  },
  "verification": {
    "model": "NOT_RUN",
    "production": "NOT_RUN",
    "scope": "ABSTRACT_MODEL",
    "artifactBindingRequired": true
  }
}
