{
  "schema": "blue-rooted-processing-fixture/1.0-draft.1",
  "id": "RCP-DYN-007",
  "category": "DYN",
  "title": "Re-add original source uses a new generation with its selected history",
  "kind": "dynamic",
  "requirements": [
    "RCP-ORDER-06",
    "RCP-GRAPH-05",
    "RCP-PROGRESS-02"
  ],
  "input": {
    "bindings": [
      {
        "address": "R/in",
        "entries": [
          {
            "timestamp": 1,
            "timeline": "R",
            "entry": "remove"
          },
          {
            "timestamp": 3,
            "timeline": "R",
            "entry": "readd"
          },
          {
            "timestamp": 5,
            "timeline": "R",
            "entry": "later"
          }
        ],
        "cursor": 0,
        "active": true
      },
      {
        "address": "R/x#g1",
        "entries": [
          {
            "timestamp": 2,
            "timeline": "X",
            "entry": "X:2"
          }
        ],
        "cursor": 0,
        "active": true
      }
    ],
    "edits": {
      "remove": [
        {
          "kind": "remove",
          "address": "R/x#g1",
          "entries": [],
          "cursor": 0
        }
      ],
      "readd": [
        {
          "kind": "attach",
          "address": "R/x#g2",
          "entries": [
            {
              "timestamp": 2,
              "timeline": "X",
              "entry": "X:2"
            }
          ],
          "cursor": 0
        }
      ]
    },
    "maxSteps": 100
  },
  "expected": {
    "trace": [
      {
        "entry": "remove",
        "receivers": [
          "R/in"
        ]
      },
      {
        "entry": "readd",
        "receivers": [
          "R/in"
        ]
      },
      {
        "entry": "X:2",
        "receivers": [
          "R/x#g2"
        ]
      },
      {
        "entry": "later",
        "receivers": [
          "R/in"
        ]
      }
    ]
  },
  "verification": {
    "model": "NOT_RUN",
    "production": "NOT_RUN",
    "scope": "ABSTRACT_MODEL",
    "artifactBindingRequired": true
  }
}
