{
  "schema": "blue-rooted-processing-fixture/1.0-draft.1",
  "id": "RCP-WORK-006",
  "category": "WORK",
  "title": "Finite self cycle",
  "kind": "reaction",
  "requirements": [
    "RCP-ORDER-05",
    "RCP-GRAPH-02",
    "RCP-READY-04"
  ],
  "input": {
    "route": {
      "A": "A"
    },
    "start": "A",
    "ttl": 2,
    "budget": 3,
    "costModel": "ONE_UNIT_PER_DELIVERY_NOT_BLUE_GAS"
  },
  "expected": {
    "status": "COMMITTED",
    "committed": [
      [
        "A",
        2,
        0
      ],
      [
        "A",
        1,
        1
      ],
      [
        "A",
        0,
        2
      ]
    ],
    "gas": 3
  },
  "verification": {
    "model": "NOT_RUN",
    "production": "NOT_RUN",
    "scope": "ABSTRACT_MODEL",
    "artifactBindingRequired": true
  }
}
