{
  "schema": "blue-rooted-processing-fixture/1.0-draft.1",
  "id": "RCP-SEL-013",
  "category": "SEL",
  "title": "A completed view contributes no candidate",
  "kind": "selector",
  "requirements": [
    "RCP-ORDER-01",
    "RCP-PROGRESS-01"
  ],
  "input": {
    "bindings": [
      {
        "address": "A/in",
        "entries": [
          {
            "timestamp": 1,
            "timeline": "T",
            "entry": "T:1"
          },
          {
            "timestamp": 2,
            "timeline": "T",
            "entry": "T:2"
          }
        ],
        "cursor": 2,
        "active": true
      }
    ]
  },
  "expected": {
    "trace": []
  },
  "verification": {
    "model": "NOT_RUN",
    "production": "NOT_RUN",
    "scope": "ABSTRACT_MODEL",
    "artifactBindingRequired": true
  }
}
