{
  "schema": "blue-rooted-processing-fixture/1.0-draft.1",
  "id": "RCP-SCOPE-001",
  "category": "SCOPE",
  "title": "Chain root A includes its forward descendants",
  "kind": "graph",
  "requirements": [
    "RCP-SCOPE-01",
    "RCP-SCOPE-02"
  ],
  "input": {
    "nodes": [
      "A",
      "B",
      "C"
    ],
    "edges": [
      [
        "A",
        "B"
      ],
      [
        "B",
        "C"
      ]
    ],
    "root": "A"
  },
  "expected": {
    "reachable": [
      "A",
      "B",
      "C"
    ]
  },
  "verification": {
    "model": "NOT_RUN",
    "production": "NOT_RUN",
    "scope": "ABSTRACT_MODEL",
    "artifactBindingRequired": true
  }
}
