{
  "schema": "blue-rooted-processing-fixture/1.0-draft.1",
  "id": "RCP-RUN-027",
  "category": "RUN",
  "title": "Missing exact input creates a typed wait and exact resume",
  "kind": "runtime",
  "requirements": [
    "RCP-SCOPE-05",
    "RCP-PROGRESS-05"
  ],
  "input": {
    "isolation": "NEW_REALM",
    "documents": [
      {
        "alias": "child",
        "source": "examples/counter.yaml"
      },
      {
        "alias": "parent",
        "source": "examples/parent.yaml"
      }
    ],
    "steps": [
      {
        "op": "scenario",
        "name": "MISSING_CONTENT_WRONG_UPLOAD_RIGHT_UPLOAD",
        "bind": "s"
      },
      {
        "op": "restartAndCompare",
        "target": "s",
        "bind": "restart"
      }
    ],
    "variants": [],
    "qualification": "RECIPE_ONLY"
  },
  "expected": {
    "assertions": [
      {
        "actual": "s.wrongUploadSatisfiedDemand",
        "op": "equals",
        "expected": false
      },
      {
        "actual": "s.sameLogicalCommandResumed",
        "op": "isTrue"
      },
      {
        "actual": "s.duplicateEffects",
        "op": "equals",
        "expected": 0
      },
      {
        "actual": "restart.exactStateAndHistoryEqual",
        "op": "isTrue"
      }
    ]
  },
  "verification": {
    "model": "NOT_APPLICABLE",
    "production": "NOT_RUN",
    "scope": "PRODUCTION_ADAPTER_REQUIRED",
    "artifactBindingRequired": true
  }
}
